Doador;CPF/CNPJ;Doador Originário;CPF/CNPJ Originário;Data;N° Recibo Eleitoral;Valor R$;Espécie do Recurso;N° Documento;Nome do Candidato;Número do Candidato;Candidatura;Partido;Unidade Eleitoral;Fonte do Recurso;
ALINE APARECIDA ALMENDROS RAMOS;276.083.968-06;;;28/10/2014;044540600000SP000004;R$ 1.500,00;Estimado;;ANTONIO CICERO DA SILVA;4454;Deputado Federal;PRP;SÃO PAULO;;
BRASILGRAFICA ABC GRAFICA E EDITORA LTDA EPP;04.912.075/0001-08;;;03/10/2014;044540600000SP000006;R$ 23,10;Estimado;;ANTONIO CICERO DA SILVA;4454;Deputado Federal;PRP;SÃO PAULO;;
EMILIO JOSE BOEIRA JUNIOR;027.176.079-60;;;09/10/2014;044540600000SP000002;R$ 550,00;Depósito em espécie;2084;ANTONIO CICERO DA SILVA;4454;Deputado Federal;PRP;SÃO PAULO;;
FERNANDA OTAVIA DIAS AMADIO NASCIMENTO;122.896.348-75;;;15/09/2014;044540600000SP000001;R$ 500,00;Depósito em espécie;367;ANTONIO CICERO DA SILVA;4454;Deputado Federal;PRP;SÃO PAULO;;
LINDOBEL DUARTE GOMES ME;08.866.299/0001-73;;;04/10/2014;044540600000SP000003;R$ 708,00;Estimado;;ANTONIO CICERO DA SILVA;4454;Deputado Federal;PRP;SÃO PAULO;;
LUANA APARECIDA GREGORIO RUBINATO;322.689.598-21;;;01/11/2014;044540600000SP000005;R$ 1.000,00;Estimado;;ANTONIO CICERO DA SILVA;4454;Deputado Federal;PRP;SÃO PAULO;;
