Doador;CPF/CNPJ;Doador Originário;CPF/CNPJ Originário;Data;N° Recibo Eleitoral;Valor R$;Espécie do Recurso;N° Documento;Nome do Candidato;Número do Candidato;Candidatura;Partido;Unidade Eleitoral;Fonte do Recurso;
Direção Estadual/Distrital;20.668.999/0001-59;PREMEO CONSTRUTIORA E EMPREEENDIMENTOS SA;17.159.658/0001-43;01/10/2014;044400600000ES000022;R$ 1.200,00;Outros títulos de crédito;;HOSANA DA SILVA SIMÕES;4440;Deputado Federal;PRP;ESPÍRITO SANTO;Outros Recursos;
JOSE WANDERLEI ASTORI;914.362.577-00;;;25/08/2014;044400600000ES000002;R$ 1.000,00;Em espécie;;HOSANA DA SILVA SIMÕES;4440;Deputado Federal;PRP;ESPÍRITO SANTO;;
PAULO CESAR HARTUNG GOMES  ;20.577.861/0001-44;CONSTRUTORA OAS S/S;14.310.577/0030-49;10/09/2014;044400600000ES000020;R$ 68,00;Estimado;;HOSANA DA SILVA SIMÕES;4440;Deputado Federal;PRP;ESPÍRITO SANTO;Outros Recursos;
PAULO CESAR HARTUNG GOMES  ;20.577.861/0001-44;CONSTRUTORA OAS S/S;14.310.577/0030-49;25/08/2014;044400600000ES000003;R$ 150,00;Estimado;;HOSANA DA SILVA SIMÕES;4440;Deputado Federal;PRP;ESPÍRITO SANTO;Outros Recursos;
PAULO CESAR HARTUNG GOMES  ;20.577.861/0001-44;CONSTRUTORA OAS S/S;14.310.577/0030-49;14/09/2014;044400600000ES000021;R$ 393,26;Estimado;;HOSANA DA SILVA SIMÕES;4440;Deputado Federal;PRP;ESPÍRITO SANTO;Outros Recursos;
