Doador;CPF/CNPJ;Doador Originário;CPF/CNPJ Originário;Data;N° Recibo Eleitoral;Valor R$;Espécie do Recurso;N° Documento;Nome do Candidato;Número do Candidato;Candidatura;Partido;Unidade Eleitoral;Fonte do Recurso;20014MG1516;
Direção Estadual/Distrital;16.739.948/0001-01;TELEMONTE ENGENHARIA DE TELECOMUNICACOES;18.725.804/0001-13;05/08/2014;015160600000MG000005;R$ 1.298,00;Estimado;;SOLANGE VITÓRIA LOURENÇO OLIVEIRA;1516;Deputado Federal;PMDB;MINAS GERAIS;Outros Recursos;20014MG1516;
Direção Estadual/Distrital;16.739.948/0001-01;SUPERMERCADOS BH COM ALIM LTDA;04.641.376/0001-36;23/08/2014;015160600000MG000002;R$ 2.299,92;Estimado;;SOLANGE VITÓRIA LOURENÇO OLIVEIRA;1516;Deputado Federal;PMDB;MINAS GERAIS;Outros Recursos;20014MG1516;
Direção Estadual/Distrital;16.739.948/0001-01;TELEMONTE ENGENHARIA DE TELECOMUNICACOES;18.725.804/0001-13;04/08/2014;015160600000MG000004;R$ 352,00;Estimado;;SOLANGE VITÓRIA LOURENÇO OLIVEIRA;1516;Deputado Federal;PMDB;MINAS GERAIS;Outros Recursos;20014MG1516;
Direção Estadual/Distrital;16.739.948/0001-01;BOM JESUS AGROPECUARIA LTDA;08.895.796/0001-08;03/09/2014;015160600000MG000003;R$ 1.450,00;Estimado;;SOLANGE VITÓRIA LOURENÇO OLIVEIRA;1516;Deputado Federal;PMDB;MINAS GERAIS;Outros Recursos;20014MG1516;
ELEICAO 2014 COMITE FINANCEIRO MG UNICO PT;20.609.045/0001-75;JBS S/A;02.916.265/0001-60;11/09/2014;015160600000MG000006;R$ 699,75;Estimado;;SOLANGE VITÓRIA LOURENÇO OLIVEIRA;1516;Deputado Federal;PMDB;MINAS GERAIS;Outros Recursos;20014MG1516;
ELEICAO 2014 JOSUE CHRISTIANO GOMES DA SILVA SENADOR;20.576.635/0001-49;JOSUE CRISTIANO GOMES DA SILVA;493.795.776-72;10/09/2014;015160600000MG000001;R$ 177,50;Estimado;;SOLANGE VITÓRIA LOURENÇO OLIVEIRA;1516;Deputado Federal;PMDB;MINAS GERAIS;Outros Recursos;20014MG1516;
