Doador;CPF/CNPJ;Doador Originário;CPF/CNPJ Originário;Data;N° Recibo Eleitoral;Valor R$;Espécie do Recurso;N° Documento;Nome do Candidato;Número do Candidato;Candidatura;Partido;Unidade Eleitoral;Fonte do Recurso;20014PA1516;
GRACIMAR VALE DA SILVA;454.198.922-00;;;16/10/2014;015160600000PA000006;R$ 580,00;Depósito em espécie;3109072;GRACIMAR VALE DA SILVA;1516;Deputado Federal;PMDB;PARÁ;;20014PA1516;
GRACIMAR VALE DA SILVA;454.198.922-00;;;03/11/2014;015160600000PA000008;R$ 5,00;Transferência eletrônica;1045730;GRACIMAR VALE DA SILVA;1516;Deputado Federal;PMDB;PARÁ;;20014PA1516;
GRACIMAR VALE DA SILVA;454.198.922-00;;;03/11/2014;015160600000PA000007;R$ 20,00;Transferência eletrônica;1035730;GRACIMAR VALE DA SILVA;1516;Deputado Federal;PMDB;PARÁ;;20014PA1516;
HELDER ZAHLUTH BARBALHO;20.578.858/0001-45;PAULO ELIAS CARDOSO BOHADANA;375.512.132-87;03/09/2014;015160600000PA000005;R$ 202,43;Estimado;;GRACIMAR VALE DA SILVA;1516;Deputado Federal;PMDB;PARÁ;Outros Recursos;20014PA1516;
HELDER ZAHLUTH BARBALHO;20.578.858/0001-45;ELIETH DE FATIMA DA SILVA BRAGA;281.114.352-15;03/09/2014;015160600000PA000004;R$ 180,00;Estimado;;GRACIMAR VALE DA SILVA;1516;Deputado Federal;PMDB;PARÁ;Outros Recursos;20014PA1516;
HELDER ZAHLUTH BARBALHO;20.578.858/0001-45;ELIETH DE FATIMA DA SILVA BRAGA;281.114.352-15;03/09/2014;015160600000PA000003;R$ 350,00;Estimado;;GRACIMAR VALE DA SILVA;1516;Deputado Federal;PMDB;PARÁ;Outros Recursos;20014PA1516;
IDA MARCYLENE SOARES GAZEL DE LYRA;480.605.692-87;;;03/08/2014;015160600000PA000002;R$ 100,00;Estimado;;GRACIMAR VALE DA SILVA;1516;Deputado Federal;PMDB;PARÁ;;20014PA1516;
JOSE ANTONIO LIMA DE SOUZA;008.881.092-53;;;03/08/2014;015160600000PA000001;R$ 100,00;Estimado;;GRACIMAR VALE DA SILVA;1516;Deputado Federal;PMDB;PARÁ;;20014PA1516;
